{
  "schemaVersion": 1,
  "id": "viewport-preparation",
  "description": "Shared f64 geometry preparation and real C/Wasm ownership conformance. Native CPU raster is host-qualified; no GPU, browser adoption or physical latency claim.",
  "sourceRevision": "7245374f8e516034b21016d6bc3421ea98c3187f",
  "cases": [
    {
      "id": "VIEWPORT-CORE-001",
      "expected": "Shared f64 preparation preserves signed endpoints, fractional backing ratios, transforms and complete contour fill; ordinary geometry needs no owned output.",
      "invariants": ["RENDER-001", "CACHE-001", "FFI-001"],
      "ownerTask": "020",
      "requirements": [
        {
          "platform": "portable",
          "level": "unit"
        }
      ],
      "testIds": [
        "cargo:sketch-core:lib:scene::viewport_tests::fractional_backing_and_transforms_preserve_both_giant_endpoints",
        "cargo:sketch-core:lib:scene::viewport_tests::normal_local_geometry_needs_no_owned_output",
        "cargo:sketch-core:lib:scene::viewport_tests::multiple_contours_keep_close_and_single_fill_color"
      ],
      "automation": "implemented",
      "gaps": []
    },
    {
      "id": "VIEWPORT-BOUNDS-001",
      "expected": "Memory, point, work, depth and nonfinite input failures reject without publishing partial preparation.",
      "invariants": ["RENDER-001", "CACHE-001", "FFI-001"],
      "ownerTask": "020",
      "requirements": [
        {
          "platform": "portable",
          "level": "unit"
        }
      ],
      "testIds": [
        "cargo:sketch-core:lib:scene::viewport_tests::preparation_rejects_memory_points_work_depth_and_nonfinite_inputs"
      ],
      "automation": "implemented",
      "gaps": []
    },
    {
      "id": "VIEWPORT-WIRE-001",
      "expected": "Prepared paging remains complete after source release; invalid selections, capacity, foreign handles and duplicate calls preserve owners.",
      "invariants": ["RENDER-001", "CACHE-001", "FFI-001"],
      "ownerTask": "020",
      "requirements": [
        {
          "platform": "portable",
          "level": "unit"
        }
      ],
      "testIds": [
        "cargo:sketch-app-wire:lib:tests::viewport_preparation::prepared_pages_are_complete_independent_and_released_exactly_once",
        "cargo:sketch-app-wire:lib:tests::viewport_preparation::invalid_selection_capacity_foreign_and_duplicate_calls_preserve_owners"
      ],
      "automation": "implemented",
      "gaps": []
    },
    {
      "id": "VIEWPORT-CODEC-001",
      "expected": "Additive preparation requests reject truncation/tails and exact response/complete contour bytes match literal fixtures.",
      "invariants": ["RENDER-001", "CACHE-001", "FFI-001"],
      "ownerTask": "020",
      "requirements": [
        {
          "platform": "portable",
          "level": "unit"
        }
      ],
      "testIds": [
        "cargo:sketch-app-wire:lib:tests::viewport_goldens::viewport_requests_have_exact_bytes_and_reject_every_truncation_and_tail",
        "cargo:sketch-app-wire:lib:tests::viewport_goldens::viewport_reply_and_whole_contour_page_match_literal_goldens"
      ],
      "automation": "implemented",
      "gaps": []
    },
    {
      "id": "VIEWPORT-NATIVE-001",
      "expected": "Native Skia CPU rendering retains signed endpoint and enclosing-curve pixels, single alpha and actual fractional asymmetric backing ratios.",
      "invariants": ["RENDER-001", "CACHE-001", "FFI-001"],
      "ownerTask": "020",
      "requirements": [
        {
          "platform": "macos",
          "level": "unit"
        }
      ],
      "testIds": [
        "cargo:sketch-renderer:macos:lib:tests::precision::actual_editor_long_stroke_preserves_far_endpoint_in_positive_and_negative_viewports",
        "cargo:sketch-renderer:macos:lib:tests::precision::enclosing_giant_curved_contour_keeps_fill_and_single_alpha",
        "cargo:sketch-renderer:macos:lib:tests::precision::clipping_budget_exhaustion_is_explicit",
        "cargo:sketch-renderer:macos:lib:tests::precision_density::huge_endpoint_uses_actual_fractional_asymmetric_backing_ratios"
      ],
      "automation": "implemented",
      "gaps": []
    },
    {
      "id": "VIEWPORT-C-001",
      "expected": "Actual native C caller exercises multipage preparation, acquisition output capacity, source release and prepared-lease shutdown ownership.",
      "invariants": ["RENDER-001", "CACHE-001", "FFI-001"],
      "ownerTask": "020",
      "requirements": [
        {
          "platform": "macos",
          "level": "bridge"
        }
      ],
      "testIds": ["native-c:portable-v2-consumer"],
      "automation": "implemented",
      "gaps": []
    },
    {
      "id": "VIEWPORT-WASM-001",
      "expected": "Actual Wasm caller exercises preparation records, bounded paging, source release, capacity rejection and prepared-lease shutdown ownership.",
      "invariants": ["RENDER-001", "CACHE-001", "FFI-001"],
      "ownerTask": "020",
      "requirements": [
        {
          "platform": "web",
          "level": "bridge"
        }
      ],
      "testIds": ["wasm-js:portable-v2-conformance"],
      "automation": "implemented",
      "gaps": []
    }
  ]
}
